repo,id,text,repo_level,symptom_cate,entity_layer,root_cause,root_cause_sub
secondlife/viewer,1614,"PBR materials exhibit striation/moiré-patterns in specular highlights | ### EnvironmentSecond Life Project Gltf Development 7.1.8.9309468311 (64bit)Release NotesYou are at 85.9, 168.0, 23.0 in Rumpus Room 4 located at simhost-040b83eb1ef209ed9.aditiSLURL: secondlife://Aditi/secondlife/Rumpus%20Room%204/86/168/23(global coordinates 35,925.9, 12,712.0, 23.0)PMFP 2024-05-31.9321100266Release NotesCPU: 12th Gen Intel(R) Core(TM) i7-12700K (3609.6 MHz)Memory: 32510 MBOS Version: Microsoft Windows 10/",C5,RA,L4,GCE,Incorrect Calculation
secondlife/viewer,1628,"Sphere mirror reflections should not flicker | ### Test plan to Ensure that spherical mirrors will be disabled.- Sphere mirror probes should no longer function- Setting up a mirror in the build floater should force it to a box probe- Changing the shape should not be available if it's a mirror----### EnvironmentAlso reproduces in build 7.1.8.9276569711Second Life Release 7.1.8.9357006492 (64bit)Release NotesYou are at 31.2, 224.2, 22.9 in Rumpus Room 2050 located at simhost-01129fe6e38889eb3.adit",C5,RA,L4,ICFM,Pipeline Misordering
secondlife/viewer,1733,UI overlap in Advanced graphics preferences | ### EnvironmentMaint-A (but should partially be in release build 7.1.8.9375512768)### DescriptionBoth buttons and 'border' overlap other UI elements![image](https://github.com/secondlife/viewer/assets/117672381/a1318208-f3a2-4ea0-b96c-5f6157d03a6c)### Reproduction stepsGo to graphical settings->advanced,C5,AF,L3,GCE,Incorrect Calculation
secondlife/viewer,1754,"Land owners overlay color is the same on the entire region | 1. World > Show > Land Owners - regardless of type (e.g., group, for sale, etc.) all owners are colored red.![bc19ba1124ff3c329059cd1362b9f807](https://github.com/secondlife/viewer/assets/119471733/d9e1f13c-21b7-4b30-9681-7e49bc78ff73)2. Others have reported that an entire region is green or orange or blue.Expected: Each parcel should correctly show the ownership of the parcel relative to the person viewing it.Note: World > Show > Prop",C5,AF,L4,RLM,Improper Initialization
secondlife/viewer,1771,"Mesh Objects Do Not Display Until You Walk Directly Over Them | 1) Visit this location: http://maps.secondlife.com/secondlife/Schreckhorn/174/228/722) Walk along the ""streets."" With the current ""PBR Featurette"" viewer some of the mesh road sections routinely do not display until you walk directly over them. Some don't display even when similar sections that are farther away do. This has been happening for some time with the ""Featurette"" track and does not occur with other viewer tracks.https://s",C5,SD,L4,ICFM,Scope Mismatch
secondlife/viewer,1773,Advanced Lighting Model info still showing in About for other languages | ### EnvironmentSecond Life Release 7.1.8.9375512768 (64Bit) VersionshinweiseCPU: 12th Gen Intel(R) Core(TM) i9-12900HK (2918.4 MHz)Speicher: 32440 MBBetriebssystemversion: Microsoft Windows 10 64-bit (Build 19044.3086)Grafikkartenhersteller: NVIDIA CorporationGrafikkarte: NVIDIA GeForce RTX 3050 Ti Laptop GPU/PCIe/SSE2Windows-Grafiktreiberversion: 31.0.15.4659OpenGL-Version: 4.6.0 NVIDIA 546.59Fenstergröße: 2560x1377Schrif,C5,AF,L3,IAC,
secondlife/viewer,1786,"#1207 EEP: Water settings only displaying one decimal place | The ""Density Exponent"" slider shows 2 decimal digits:![image](https://github.com/secondlife/viewer/assets/124201357/753c2adc-6759-474a-b5d1-ec4ab8a5824e)Three ""Reflection Wavelet Scale"" sliders are being fixed by this change:![image](https://github.com/secondlife/viewer/assets/124201357/9500701e-cf41-4b92-b563-81adad96f8fd)",C5,AF,L3,GCE,Insufficient Precision
secondlife/viewer,1794,#1644 On-water property lines persist at water level | When water is rendered:![image](https://github.com/secondlife/viewer/assets/124201357/13334c96-ea23-4851-b3db-19c3a35d9e00)When water is NOT rendered:![image](https://github.com/secondlife/viewer/assets/124201357/d75c132f-0c68-469f-b076-feb69aa6faff),C5,SD,L4,ICFM,Scope Mismatch
secondlife/viewer,1835,"Directional Input Delays with latest PBR-Capable Viewers | Repro: (Courtesy of Atomic Infinity. Thank you!)1. Go to an empty region and let everything load - I used an empty sandbox.2. Put the following script in a prim, then add/wear it on your avatar.3. Press and hold the Left arrow key down for 10 seconds.4. At the end of 10 seconds, the script will report how many control events triggered in those 10 secs.5. You can then let go the arrow key, and repeat the test to verify the results.6. Log ",C5,IC,L1,GCE,Incorrect Calculation
secondlife/viewer,1847,Negative UV scale causes wrong lighting on PBR materials | ### DescriptionApplying a negative scale u or scale v to a prim with the PBR material causes the lighting to shine from the wrong direction.These other tickets are related but not equivalent:- https://github.com/secondlife/jira-archive/issues/10768- https://feedback.secondlife.com/bug-reports/p/normal-map-tangents-are-wrong-if-normal-map-is-mirrored-with-the-edit-tool,C5,AF,L4,GCE,Incorrect Calculation
secondlife/viewer,1905,"The ""Share"" and ""Pay"" buttons are active when selecting multiple avatars in Nearby tab | ### EnvironmentSecond Life Release 7.1.9.9620320242 (64bit)Release NotesYou are at 186.6, 62.9, 21.5 in Product Engine located at simhost-0afb4afe97480773f.agniSLURL: http://maps.secondlife.com/secondlife/Product%20Engine/187/63/21(global coordinates 336,827.0, 307,263.0, 21.5)Second Life Server 2024-06-11.9458617693Release NotesCPU: 11th Gen Intel(R) Core(TM) i5-11260H @ 2.60GHz (2611.2 MHz)Memory: 16111 MB",C5,IC,L3,IAC,
secondlife/viewer,1917,"The  'No emoji selected' message appears and overlaps emoji name in the Choose Emoji floater | **Steps to reproduce:**1. Login to the [viewer](https://github.com/secondlife/viewer/releases/tag/Second_Life_Release%2308f2236-atlasaurus).2. Type "":hand"" in Nearby chat.3. Observe the Choose Emoji floater.**Actual result:** The  ""No emoji selected"" message appears and overlaps emoji name.**Expected result:**The message should not appear(or should be appeared without overlapping).<details><summary>act",C5,AF,L3,ICFM,Scope Mismatch
secondlife/viewer,1923,"UI Oddity in Script Window | Cross-posted from FIRE-34053The 'Search / Replace' floater and Script Window argue about top/height somehow and makes resizing strange. Video included to reproduce.Relevant info:    This likely happens in other areas where a floater can attach to another. Im not sure where to look.    High DPI monitor, has caused issues before. No overrides done, and UI scale is 1.0.https://secondlife.canny.io/admin/board/bug-reports/p/ui-oddity-in-script-window",C5,SD,L3,GCE,Incorrect Calculation
secondlife/viewer,1932,"A toast with a message is not displayed if the chat is placed in a separate window and minimized | ### Environment<details><summary>Environment</summary><p>Second Life Release 7.1.9.9620320242 (64bit)Release NotesYou are at 130.5, 118.4, 22.8 in Product Engine 3 located at simhost-02329e0edf37d025f.agniSLURL: http://maps.secondlife.com/secondlife/Product%20Engine%203/131/118/23(global coordinates 336770.0, 307062.0, 22.8)Second Life Server 2024-06-11.9458617693Release NotesCPU: Intel(R) Core(TM)",C5,AF,L3,ICFM,Scope Mismatch
secondlife/viewer,1965,Selection swirls swirl forever when the UI is hidden. | When you hide ui even with all the beams and such off anyone right clicks or clicks on things will add circles only in pbr viewer. Only go away when show ui or remove particles.(when filming in sl like wrestling and so on this results in visual issues with seeing the circles everywhere.)Hiding UI: Alt+ctrl+f1https://secondlife.canny.io/admin/board/bug-reports/p/pbr-viewer-ui-hide-bug,C5,RA,L3,ICFM,Scope Mismatch
secondlife/viewer,1973,viewer#1965 Fixed selection swirls swirling forever when the UI is hidden | Update UI particle timers even if UI is hidden to let them die.,C5,RA,L3,ICFM,Scope Mismatch
secondlife/viewer,1988,"The 'Set Empty' option does not remove previously applied keys for all control modes with the 'Apply to all' checkbox | **Steps to reproduce:**1. Login to the [viewer](https://github.com/secondlife/viewer/releases/tag/Second_Life_Release%2308f2236-atlasaurus).2. Go to Me > Preferences... > Controls.3. Change Primary Control, Alternate 1 or Alternate 2 next to 'Move Forward' action with checked 'Apply to all'.4. Click Primary Control, Alternate 1 or Alternate 2 that was applied in previous step.6",C5,IC,L3,IIV,
secondlife/viewer,2017,"Fix: Stop textures from being set as inactive if still on a face. | Textures were being set to Inactive even if still in scene, causing them to be deleted and re-decoded in a loop.",C5,AF,L4,ICFM,Pipeline Misordering
secondlife/viewer,2027,"Cannot apply PBR Materials on larger linksets | 1. Create and link at least 43 objects together, I used prim boxes.2. Select PBR material in the texture edit tab3. Drag and drop a material from your inventory onto the Material preview box4. Material will look applied. But It is not visible to anyone else. De-rezz and re-rezz (or relog), material will disappear.5. Unlink enough parts so you're at 42 or less linked parts6. Repeat the process - it will work now.Tinting faces seems to also have a si",C5,IC,L4,ICFM,Scope Mismatch
secondlife/viewer,2064,"After crossing from a WebRTC region to another WebRTC region the spatial voice dot of nearby people is off. | ### EnvironmentSecond Life Release 7.1.9.9688089989 (64bit)Release NotesYou are at 19.4, 121.4, 22.9 in webRTC2 located at simhost-02bfc572742fa99b4.aditiSLURL: secondlife://Aditi/secondlife/webRTC2/19/121/23(global coordinates 260,115.0, 245,369.0, 22.9)WebRTC-Voice 2024-06-24.9652733849Release NotesCPU: Intel(R) Core(TM) i7-5930K CPU @ 3.50GHz (3491.92 MHz)Memory: 32610 MBOS Version: M",C5,SD,L4,ICFM,Pipeline Misordering
secondlife/viewer,2144,"Add tooltip to the region Object Return button to clarify who ""someone else"" means. | ### EnvironmentSecond Life Release 7.1.9.9620320242 (64bit)### DescriptionSome unclear terminology was highlighted in https://github.com/secondlife/server/issues/1246. In World -> Region/Estate -> Debug, there is an option to return objects ‘On someone else's land.' It could be read to mean ""return the selected users' objects that are not on land owned by the person pushing the button"" (an estate owner or estat",C5,AF,L3,UPF,
secondlife/viewer,2160,"viewer#2157 Toolbar's drop position indicator does not appear | Regression from maint-a's changes. Originaly it was '? FALSE : TRUE', so I flipped the logic.Basically logic is supposed to dibale indication right after current spot (mDragRank) and before current spot (mDragRank-1).",C5,AF,L3,ICFM,Scope Mismatch
secondlife/viewer,2279,Camera View Angle Not Working | Preferences > Move&View > View Angle . This slider stopped working after Aug 12th update.There is something wrong going on with camera view settings on the new viewer update. I have been tweaking it and I can't go back to the default rear avatar view with a correct distance.https://secondlife.canny.io/admin/board/bug-reports/p/view-angle-not-working,C5,VF,L5,IIV,
secondlife/viewer,2323,"Hair (and other alpha items) Transparency issues causing 'bleed' effect to textures | This issue is separate from the one described at https://feedback.secondlife.com/bug-reports/p/pbr-client-opacity-issue-on-textures-with-alpha-channel-windows.In this case, some hairstyles are experiencing a texture bleeding problem, which results in areas appearing thicker where they previously consisted of fine hairs. This was observed and tested with Geenz and Runitai Linden during a Content Creators Meeting",C5,RA,L4,GCE,Incorrect Calculation
secondlife/viewer,2410,"Combat 2.0 settings not reflected on heart icon | ### EnvironmentSecond Life Release 7.1.8.9375512768 (64bit)Release NotesYou are at 128.0, 128.0, 4.6 in Woodbine located at simhost-09439c288d680e731.agniSLURL: http://maps.secondlife.com/secondlife/Woodbine/128/128/5(global coordinates 261,248.0, 233,088.0, 4.6)Second Life Server 2024-07-22.10048683488Release NotesCPU: 12th Gen Intel(R) Core(TM) i9-12900H (2918.41 MHz)Memory: 32459 MBOS Version: Microsoft Windows 10/11 64-bit (Build 22621.4037)G",C5,IC,L3,UPF,
secondlife/viewer,2427,"When clicking on a toast message from a user in a minimized IM chat that is taken out separately from the Conversation floater, the Conversation floater opens, not a separate IM chat | ### Environment<details><summary>Environment</summary><p>Second Life Release 7.1.10.10516785745 (64bit)Release NotesYou are at 119.0, 114.0, 22.9 in Product Engine 3 located at simhost-0cd70bedfc4667751.agniSLURL: http://maps.secondlife.com/secondlife/Product%20Engine%203/119/114/23(global coordinates 336759.0, 30",C5,IC,L3,ICFM,Pipeline Misordering
secondlife/viewer,2469,"#2454 Scrolling by the mouse wheel does not scroll up on the unopened Destination field | The destination list is- Last location- Home location- (disabled list item with no text)- [favorite locations]The current implementation of the `handleScrollWheel()` method is getting stuck on the disabled itemand loses the selection, and after losing the selection this implementation even doesn't try to do anythingThe proposed solution is based on using new methods `selectNextItem()` and `selectPrevItem()`",C5,IC,L3,ICFM,Unbounded Loop
secondlife/viewer,2505,#2461 changing the color of my dot on the minimap | New glyph looks plain white:![image](https://github.com/user-attachments/assets/699d7873-c6d6-41ca-bdb0-6bad04f07b14),C5,AF,L3,UPF,
secondlife/viewer,2558,"Everything Looks Black and White Mac Silicon | ### EnvironmentSecond Life Release 7.1.10.10800445603 (64bit)Mac M2### DescriptionThis issue is being reproduced but reportedly only on M2 macs: https://github.com/secondlife/viewer/issues/1852### Reproduction steps 1. (I've not been able to repro this on an M1. -Dan)1. Visit this location: [Panfield](http://maps.secondlife.com/secondlife/Panfield/59/121/22)2. Change the reflection coverage settings from ""Manual"" to ""Full Scene"".3. Wait 10-20 minute",C5,RA,L5,ICFM,Pipeline Misordering
secondlife/viewer,2572,Voice dot appears next to avatar's name in Conversations floater when Voice Chat was disabled prior to login | ### EnvironmentSecond Life Test 7.1.11.10800977053 (64bit)Release NotesCPU: Apple M1 Pro (2400 MHz)Memory: 16384 MBOS Version: macOS 14.6.1 Darwin 23.6.0 Darwin Kernel Version 23.6.0: Mon Jul 29 21:14:30 PDT 2024; root:xnu-10063.141.2~1/RELEASE_ARM64_T6000 x86_64Graphics Card Vendor: AppleGraphics Card: Apple M1 ProOpenGL Version: 4.1 Metal - 88.1Window size: 1225x867Font Size Adjustmen,C5,AF,L3,IIV,
secondlife/viewer,2577,"Worn transparent prims/meshes no longer show with ""Highlight transparent"" | Frionil Fang's recipe reproduced this for me:This reproduces for me with just a basic default prim. Create a cube, set it to 100% transparent, pick it up. Have highlight transparent off, attach it. Turn highlight transparent on, the cube is not shown on the right hand until doing the zoom in/out trick or selecting it manually. It's especially noticeable with invisible prims since those are often used with rigged mesh to ",C5,RA,L4,ICFM,Scope Mismatch
secondlife/viewer,2637,"Projected texture is visible on an alpha blending surface | ### EnvironmentSecond Life Release 7.1.11.10947335521 (64bit)Release NotesYou are at 67.9, 39.5, 38.8 in Danger! Danger! located at simhost-0dd7e33bcf6d85949.agniSLURL: http://maps.secondlife.com/secondlife/Danger%21%20Danger%21/68/40/39(global coordinates 261,188.0, 249,640.0, 38.8)Second Life Server 2024-07-22.10048683488Release NotesCPU: Intel(R) Core(TM) i7-5930K CPU @ 3.50GHz (3491.92 MHz)Memory: 32610 MBOS Version: Microsoft Windo",C5,RA,L4,GCE,Incorrect Calculation
secondlife/viewer,2639,"Performance metrics should be consistent between benchmark runs | ### Test plan to confirm this fix has been reverted in ForeverFPS:1. Start the ForeverFPS viewer.2. Open Preferences > Graphics and click the ""Reset to recommended setting"" button.3. Note the Quality & speed slider position.4. Confirm the Quality & speed slider position is the same as when this test is run on the ExtraFPS viewer (https://releasenotes.secondlife.com/viewer/7.1.11.12363455226.html).### EnvironmentSecond Life Release",C5,SD,L3,ICFM,Pipeline Misordering
secondlife/viewer,2646,"The ""Physics Shape Type"" parameter is changed back to the ""None"" option after choosing the ""Prim"" or ""Convex Hull"" option in the ""Features"" tab of the ""Build"" floater | ### Test plan- The original repro below.- please test all combo boxes / dropdowns and scroll bars found in each of the following floaters:    Gestures    Build    Inventory    Whatever other floaters you may think of! 😸### EnvironmentSecond Life Release 7.1.11.10947335521 (64bit)Release NotesYou are at 213.6, 106.8, 21.5 in Produ",C5,IC,L3,IAC,
secondlife/viewer,2663,#2655 update alpha gamma drop down position | Also minor changes: disable drop down when the object is not editable and enable correct text label otherwise.![image](https://github.com/user-attachments/assets/623e2a3c-9f95-46b6-a56f-49ed03daa948),C5,AF,L3,UPF,
secondlife/viewer,2671,viewer-private#291 Object floating text does not update without moving camera | ,C5,SD,L5,RLM,Improper Initialization
secondlife/viewer,2680,"Restore currently entered text in chat entry textbox after going through history with Ctrl-PgUp/PgDown | This changes a rather inconvenient annoyance in the chat entry textbox. Say you entered several messages and started typing a new message into the chat entry textbox, you then decide to scroll through the history with Ctrl-PgUp/PgDown and then return to the actual input, everything you entered is gone and you have to enter it again. This change will restore the current input from before scrol",C5,AF,L3,RLM,Improper Initialization
secondlife/viewer,2709,Nametags appear squashed | ### EnvironmentExtraFPS 7.1.11.10947335521 Both Win11 and Mac### DescriptionNametags have an odd dip in ExtraFPS.![Screen Shot 2024-09-26 at 11 07 46 AM](https://github.com/user-attachments/assets/36c7f0c9-3360-4b5a-a6fc-d15f12837d80)### Reproduction stepsView nametags,C5,AF,L3,GCE,Incorrect Calculation
secondlife/viewer,2711,About SL still showing ALM on some languages | ### EnvironmentDeltaFPS 7.1.10.10800445603### DescriptionAdvanced Lighting Model is still being shown in About Second Life for multiple languages. Value is provided as [GPU_SHADERS].Deutsch: ![image](https://github.com/user-attachments/assets/9dfc9541-ecc0-4e82-b3b6-47086329d809)Spanish:![image](https://github.com/user-attachments/assets/134e4733-93bb-4b4a-bc04-ef3851891fcb)French:![image](https://github.com/user-attachments/assets/1d326610-6d10-448,C5,AF,L3,TDI,
secondlife/viewer,2753,"Gestures ""Animation to play"" drop-down box always displays ""--None--"" | ### EnvironmentExtraFPS 7.1.11.11074622243### DescriptionThe Gesture ""Animation to play"" drop-down box displays ""-None-"" after selecting an animation from the list.### Reproduction steps1. Login to Viewer.2. Open Inventory -> Gestures -> select any gesture and open.3. Click to the ""Animation to play"" drop-down box and select any animation.",C5,IC,L3,RLM,Improper Operation
secondlife/viewer,2772,Fix pink flash when window is resized | Fix a magenta flashing that appeared with 6ebd6494a75d9b3d34e45655d79d0027fbba3898 by restoring clearing of the deferred screen target,C5,RA,L5,IAC,
secondlife/viewer,2780,"Lower terrain material incorrectly shown momentarily | ### EnvironmentDeltaFPS (7.1.10.10800445603) and ExtraFPS (7.1.11.11074622243)### DescriptionUpon teleporting to region [TextureTest](http://maps.secondlife.com/secondlife/TextureTest/168/136/23), the lower terrain material is observed in areas that should only be displaying Materials 1 and 2 (according to the Region/Estate Terrain tab).Clip of issue: https://gyazo.com/6cda7e75f21be933931c19097bebb160Occasionally it may stick around for long",C5,RA,L4,ICFM,Pipeline Misordering
secondlife/viewer,2863,"[overrides] Edit of alpha to opaque not holding when edit is done in object | Test object is in the contents of ""viewer#2863"" http://maps.secondlife.com/secondlife/Danger!%20Danger!/73/82/39I have not been able to reproduce this myself, but it reproduces for a few moles and for Whirly Fizzle.Repro:1. Maybe be a long distance from the data center?Observed: The arm of the chair appears transparent so that the seat can be seen through it.![Image](https://github.com/user-attachments/assets/1f925024-",C5,AF,L4,ICFM,Pipeline Misordering
secondlife/viewer,2883,"Text is temporarily small after resizing SL down, or large after resizing SL up | ### EnvironmentSecond Life Release 7.1.11.11074622243 (64bit)Release NotesCPU: Intel(R) Core(TM) i7-5930K CPU @ 3.50GHz (3491.91 MHz)Memory: 32610 MBOS Version: Microsoft Windows 10 64-bit (Build 19045.5011)Graphics Card Vendor: NVIDIA CorporationGraphics Card: NVIDIA GeForce GTX 1080/PCIe/SSE2Windows Graphics Driver Version: 32.0.15.6590OpenGL Version: 4.6.0 NVIDIA 565.90Window size: 1587x1217Font Size Adjustment:",C5,RA,L3,RLM,Improper Initialization
secondlife/viewer,2894,"Scaling of repeats in Blinn Phong and PBR behaves differently when stretch textures is not applied. | When editing an object with both BP and PBR textures applied and texture stretching is not used, the manner in which the repeats are done in BP and PBR are not the same. The BP textures stay centered on the surface while PBR are keyed to the edge, causing a mismatch in the textures when viewed in BP from how they appear in Blinn Phong.https://gyazo.com/cae813090a87365a7eb321a28455716chttps://sec",C5,SD,L4,RLM,Improper Operation
secondlife/viewer,2964,"[BUG] Glow causing incorrect render behavior. | Environment:Second Life Release 7.1.10.10800445603 (64bit)Using PBR materials with Glow and Emissive is causing an incorrect alpha sorting behaviour.  this behaviour is new as of 7.1.10 and did not exist before (see 7.1.9).This effectively breaks all PBR items using 'Glow' and 'Alpha'Repro:1. rez a cube, set it to 50% transparent, (or any existing alpha object)2. rez another cube3. apply a PBR material4. set alpha mode to 'Blend'5. set alpha to 0.0",C5,RA,L4,ICFM,Pipeline Misordering
secondlife/viewer,2971,"secondlife/viewer#2768: Partial fix for PBR texture animations stopping. May also fix some Blinn-Phong texture animations. | This is a partial fix to https://github.com/secondlife/viewer/issues/2768 . The fix appears to prevent PBR texture animations from sometimes stopping when looking away and then looking back. However, there is still an issue with PBR texture animations not starting.",C5,RA,L4,ICFM,Scope Mismatch
secondlife/viewer,2997,"The ""Reset Skeleton"" option is missing in the right-click menu of an animated object | ### Reproduction steps1. Download and install the [Second Life Release 7.1.12.11386494836](https://github.com/secondlife/viewer/releases/tag/Second_Life_Release%230ef7a9b-maint-c-2024-10-17) build.2. Log in.3. Teleport to any animated object (e.g. Animesh Aditya http://maps.secondlife.com/secondlife/Product%20Engine/156/17/21).4. Right-click on animated object.5. Observe the menu options.**Actual result:**The ",C5,AF,L3,ICFM,Scope Mismatch
secondlife/viewer,2999,"[Win] An avatar complexity information is flickering on the ""Name tags"" field above the avatar's head | ### Reproduction steps:1. Download and install the [Second Life Release 7.1.12.11386494836](https://github.com/secondlife/viewer/releases/tag/Second_Life_Release%230ef7a9b-maint-c-2024-10-17) build.2. Click ""Me""→""Preferences...""→""Advanced""→Check the ""Show Advanced menu"" checkbox.3. Log in.4. Click ""Advanced""→""Performance Tools""→""Shown avatar complexity information"".5. Turn your avatar and obse",C5,RA,L3,RLM,Improper Initialization
secondlife/viewer,3001,"Avatar running is not working via double-clicking shortcut buttons | ### Reproduction steps1. Download and install the [Second Life Release 7.1.12.11386494836](https://github.com/secondlife/viewer/releases/tag/Second_Life_Release%230ef7a9b-maint-c-2024-10-17) build.2. Log in.3. Double-click and hold the ""W"" or ""Up Arrow"" button.4. Observe the avatar's movement.5. Repeat steps 3-4 using the ""S"" or ""Down Arrow"" button. **Actual result:**Avatar running is not working via double-clicking shortcut bu",C5,IC,L1,ICFM,Pipeline Misordering
secondlife/viewer,3026,"secondlife/viewer#2768: Fix for PBR texture animations sometimes not starting | Follow-up to https://github.com/secondlife/viewer/pull/2971 .This fixes another case where PBR texture animations did not play, if the PBR base material does not contain textures but the GLTF material overrides do. The GLTF material overrides were arriving sufficiently late such that the texture virtual size was calculated to be 0, which prevented the texture matrix from being copied over to the `LLDrawInfo`. Since t",C5,RA,L4,IAC,
secondlife/viewer,3034,Emoji temporarily breaks when chat scrolls up. | ### EnvironmentSecond Life Release 7.1.11.11565212741 (64bit)Release NotesCPU: Intel(R) Core(TM) i7-5930K CPU @ 3.50GHz (3491.92 MHz)Memory: 32610 MBOS Version: Microsoft Windows 10 64-bit (Build 19045.5011)Graphics Card Vendor: NVIDIA CorporationGraphics Card: NVIDIA GeForce GTX 1080/PCIe/SSE2Windows Graphics Driver Version: 32.0.15.6590OpenGL Version: 4.6.0 NVIDIA 565.90Window size: 1732x1234Font Size Adjustment: 96ptUI Scaling: 1Draw distance: ,C5,RA,L3,RLM,Improper Initialization
secondlife/viewer,3036,Fix url and toolbar menus binding callback functions to global scope | This was resulting in plain text chat mode name menus binding to the first avatar name right clicked and then not functioning correctly on subsequent menu attempts,C5,IC,L3,RLM,Improper Shutdown
