repo,id,text,repo_level,symptom_cate,entity_layer,root_cause,root_cause_sub
felixmariotto/three-mesh-ui,102,fix: missing border color | Fixes a bug in my last pull request. Adds back color to the border (sorry about that).![Screenshot 2021-12-17 at 13 05 18](https://user-images.githubusercontent.com/5284715/146548913-2d3a57f8-f4bb-4ace-aa4a-27abc17c3980.png),C4,AF,L3,UPF,
felixmariotto/three-mesh-ui,105,"Fix letter spacing next line break | There was the artefact that was causing that. I replayed all examples, everything seems up again.",C4,RA,L3,GCE,Incorrect Calculation
felixmariotto/three-mesh-ui,128,improve frames antialiasing | Smooth out the edges of frames and the line between the frames background and border.## before:![Screenshot_3](https://user-images.githubusercontent.com/46470486/150112656-cf26449e-d1d4-4934-9847-27647768f885.jpg)## after:![Screenshot_2](https://user-images.githubusercontent.com/46470486/150112619-a75b3948-106a-484b-bd52-487312c094bd.jpg)combined with #125 it will give three-mesh-ui objects a much more polished look.,C4,RA,L5,GCE,Insufficient Precision
felixmariotto/three-mesh-ui,132,"update default font | More recent version of Roboto from Google Font.This change fixes #48 I checked the whole charset and it's clean, no dent nowhere:![Screenshot_1](https://user-images.githubusercontent.com/46470486/150403463-1a66e086-e9e2-430f-851d-e02e01c7c431.jpg)",C4,AF,L3,IIV,
felixmariotto/three-mesh-ui,140,improve best_fit example | Some slight improvements of the new best-fit example : - panels centered in the scene- borders- rounded edges- more contrasting colors for readability- enable stats![Screenshot_3](https://user-images.githubusercontent.com/46470486/150538629-b649bbaf-611e-41df-bcc2-9de565aef7b2.jpg),C4,AF,L3,UPF,
fholger/farcry_vrmod,21,"Black scope while streaming | The OICW/AG36 rifles have a black screen in the scope for stream viewers at 0.6.0 version.(This was spotted while streaming on discord) This is not found on sniper rifles, only on rifles with underbarrel grenade launcher.",C5,AF,L5,ICFM,Pipeline Misordering
fholger/openvr_foveated,7,"[IL-2 Sturmovik]: Pimax canted displays double rings in left eye | **Which game is affected?**IL-2**Describe the issue**Hi Fholger. Nice to see this tool, after your last one, Openvr_FSR. In that last tool you solved right positioning of the center of the screens for canted displays. Now in a new tool only the sharpening circle works good, and foveated circles are not good:1) foveated circles are actually ellipse (similar to VR view ratio), but sharpening circle is still circle. Please make all ",C2,VF,L5,RLM,Improper Initialization
fholger/openvr_fsr,131,"F2 key still activates with hotkeys  set to false | F2 Key is still being read by the driver even when:`    ""hotkeys"": {      // If enabled, you can change certain settings of the mod on the fly by      // pressing certain hotkeys. Good to see the visual difference. But you      // may want to turn off hotkeys during regular play to prevent them from      // interfering with game hotkeys.      ""enabled"": false,`",C2,IC,L1,IIV,
fholger/thedarkmodvr,2,"Oculus CV1, initial head direction seems to always be facing backwards | When I start up a mission and load in, I'm actually facing the wrong way. To play reasonably, I need to start the game up with the headset pointing behind me until in a mission, then put it on the right way.Thanks for doing this work, TDM in VR will be amazing!",C5,VF,L5,ICFM,Pipeline Misordering
fholger/vrperfkit,30,"Doesnt work with Iracing | I've got all working fine with ACC and AMS2, but with Iracing the image loads only on the monitor, in the headset there is no image, only ""loading"". This is in Oculus mode with a Quest 2. Any idea?",C2,RS,L5,IIV,
fpw/avitab,42,Airport overlay bugfixes | Fix pixel corruption from Image pixel resize not being fully clearedFix rendering where narrow runway width results in line not rectangle,C5,RA,L4,IIV,
fpw/avitab,63,"Tabbed pdf | This pull request adds a tabbed pdf reader to the charts app, fixing #50.![b738 - 2020-07-19 18 51 42](https://user-images.githubusercontent.com/5869151/87880326-2992a880-c9f1-11ea-9cd5-e61aec4c4248.png)I first tried to modify FileSelect and PDFViewer to display their contents in tabs, but found this more difficult than expected (I'm not that experienced with C++) and instead ended up copying most of their functionality into the charts app. The app now uses a single tab to show the ",C5,AF,L3,IAC,
fpw/avitab,121,"Enhance Charts app PDF viewing when moving between pages or rotating. | When opening single page PDFs and images these will be zoomed to fit andaligned centrally.Multiple page docs will be zoomed to fit width of first page and alignedat the top (in the middle).When moving to the next page this will be aligned at the top to assistcontinuity if reading. Similarly, when moving to the previous page thiswill be aligned at the bottom.After rotation the page will be aligned centrally for single page do",C5,SD,L3,ICFM,Pipeline Misordering
fpw/avitab,186,Improvements to route overlaying at the -180/+180 longitude discontinuity | These modifications enhance the depiction of the route leg that crosses the discontinuity by avoiding the addition of a route waypoint at the discontinuity. The update also fixes a route overlay bug at the -180/+180 longitude discontinuity. The formula for working out the latitude where the route leg crossed the boundary contained an error which resulted in the image::drawLine() method getting stuck in an infinite loop. ,C5,RS,L4,GCE,Incorrect Calculation
fpw/avitab,203,"Fix bug for no overlays in rotated charts | Recently introduced in""Support wrapping of map tiles at -180/180 longitude. ""If a chart (e.g. EGBB Birmingham A380 Ground Movement) is heavily rotated, rightLpn can be < leftLon.Check for non rotated tile source when skipping overlay.",C5,SD,L3,IIV,
fredemmott/HTCC,10,"DCS: world-lock virtual controller while clicked | With virtual touch screen, you can click and hold the signal lamp test button on the A10C then look around, e.g. at the signal lamps :pWith virtual controller, DCS releases the button as soon as the pointer stops looking *exactly* at itThis is very fiddly even with real VR controllers, and just doesn't work well. Instead, the controller should be world-locked while any button is pressed.",C5,IC,L1,ICFM,Scope Mismatch
fredemmott/HTCC,24,"Left VR controller ""squeeze"" always on in MSFS | When using Leap hand tracking, the left controller squeeze function is permanently ""pressed"".With default bindings, this operates the left brake of the aircraft.Unmapping the binding in the MSFS control options menu resolves the negative impact, although I suspect the command is still being issued due to right hand tracking never starting unless left hand has been ""seen"" first.",C5,IC,L1,ICFM,Scope Mismatch
frustra/strayphotons,160,"Don't draw in hidden area of HMD | Implements stencil pipeline configuration, and uses it to mask out the hidden area of the XR display.",C3,VF,L5,TDI,
frustra/strayphotons,200,Present empty image when there's no window entity | The window view is now loaded asynchronously and thus the renderer can start before it exists. This renders a blank frame (and the debug gui even works) if the default window view target (i.e. FlatView) doesn't exist.This could be changed to draw an image if we want at some point.,C3,RA,L5,IIV,
frustra/strayphotons,278,"AMD fixes, better histogram, don't treat metalness/roughness as sRGB | Last remaining thing is that the voxel grid is a bit flickery (the overflow lists aren't being merged properly).",C3,RA,L4,GCE,Incorrect Calculation
frustra/strayphotons,310,"Remove view pos gbuffer, fix specular cone brdf | This makes voxel mirror reflections work. Also fixes artifacts due to the position buffer not having enough precision.",C3,RA,L5,GCE,Insufficient Precision
frustra/strayphotons,329,VR player physics update | - Don't jump player on boot when headset starts tracking- Fix player getting pushed back by walls- Teleport controllers to player if they get too far away,C3,SD,L4,IIV,
frustra/strayphotons,349,Controller fixes | - Add button press events to vive controllers- Add support for simultaneous grab events- Fix outline rendering for template / sub-entity items- Add some mirror cubes to the menu scene,C3,AF,L1,RLM,Improper Operation
frustra/strayphotons,383,Transparent Rendering | This PR adds:- RGB and CMY color filter assets- Fixes cloudfront asset caching issue- Primitive-level draw sorting based on view position- New lighting shader for transparency forward pass- Lighting gel rendering via dual-source blending functionRemaining issues:- Shadow maps don't sample the incoming shadow map or light texture correctly- Light gels don't interact with the voxel grid correctly due to normals,C3,RA,L4,IAC,
frustra/strayphotons,479,Fixed output charge cell | - Fix signal display gui rendering- Add `!signal` operator to signal expressions- Update charge cell to have a fixed output color/power,C3,AF,L3,TDI,
frustra/strayphotons,575,Add star skybox shader | This adds a new star skybox shader that will render for any parts of the screen with nothing drawn.Also in this PR:- Make the menu projection wall transparent glass- Fix the asset folder listing to only show the first directory level- Tweak the crosshair to scale the dots with DPI scaling,C3,RA,L4,RLM,Improper Initialization
frustra/strayphotons,576,Fix profiler gui not showing up | In this PR:- Store the profiler GUI instance on the DeviceContext- Fix the OverlayGuiManager for Floating windows- Adjust the profiler GUI to make the window resizable,C3,AF,L3,ICFM,Scope Mismatch
galister/wlx-overlay-x,8,"Bugfix: Mouse move event is fired before launching ""Mouse up"" event | This caused issues with pressing links, for example Discord channels. Before this fix, the user needed to have a very steady hand to not fire Drag event in the target application.Mouse drag after 300ms freeze time still works properly.Moved `input.mouse_move(...)` below `input.send_button(...)`Added support for reading click_freeze_time_ms from AppSession",C5,IC,L1,ICFM,Scope Mismatch
gearvrf/GearVRf-Demos,97,Change immersivepedia's icon; stop background audio on pause | ,C5,AF,L3,ICFM,Pipeline Misordering
gearvrf/GearVRf-Demos,210,gvr-video: Radiosity Effect stops working if change to IMAX mode and back | I observed that Radiosity effect won't work if switch to IMAX mode in theater environment 2 and come back to normal mode.,C5,RA,L4,GCE,Incorrect Calculation
gearvrf/GearVRf-Demos,273,valueFloatTexture must be set when create circle alpha | If not set first time render result in error and error shader is calledGearVRf-DCO-1.0-Signed-off-by: Deepak Rawat deepak.rawat@samsung.com,C5,RA,L5,IIV,
gearvrf/GearVRf-Demos,350,gvr-solarsystem: fix the sun position | This is Roshan's fix from couple of months back.Previously the sun was centered at the origin (the camera was inside the sphere) so that lead to:- no sun visible because the back faces are culled- a draw call no matter where you would look atGearVRf-DCO-1.0-Signed-off-by: Mihail Marinov m.marinov@samsung.com,C5,SD,L4,GCE,Incorrect Calculation
gftruj/aframe-hand-tracking-controls-extras,5,"not able to move objects using the pinching gesture | Hi @gftruj,**Objective**: to move the objects by pinching them in any direction.**Issue**: The moment I pinch with my left hand the objects disappear from the scene**JsFiddle**: [link](https://jsfiddle.net/adwait3301/6a2mht35/55/)This is the component I wrote to move the object```   AFRAME.registerComponent('pinch-to-move-sickle', {        dependencies: ['pinchable'],                init: function() {          var sceneEl = document.querySele",C4,IC,L1,TDI,
google-ar/three.ar.js,31,Transparency flicker fix | Bug fix for flickering transparency on rendered objects in the scenes on iOS. Resolved by clearing the color on the frame at the beginning of the update. Change propagated onto all examples in the repo.,C4,RA,L4,RLM,Improper Initialization
google-ar/three.ar.js,57,"`loadBlocksModel()` issue with some MTL textures | Loading [this blocks model](https://poly.google.com/view/f7q6m6IL8UI), I get an all red box like this when calling `ARUtils.loadBlocksModel('model.obj', 'materials.mtl')`:<img width=""454"" alt=""screen shot 2017-11-04 at 5 15 19 pm"" src=""https://user-images.githubusercontent.com/641267/32410671-faa17718-c183-11e7-8087-41237dbca0b8.png"">When I manually use OBJLoader/MTLLoader in the same method as  A-Frame's [obj-model component](https://github.com",C4,AF,L4,TDI,
googlearchive/vrview,36,"Prevent zero pixel ratio in renderer | ... so that on browsers where page is zoomed out (zoom level less than 100%), the canvas dimension is not zero on page refresh. When the width and height of the canvas are zero on initialization, the loaded scene is black.",C5,SD,L5,GCE,Divide By Zero
googlearchive/vrview,199,"Fix mute function in FF and Safari | Hi Guys,video.setAttribute('muted', 'true'); doesn't work well on Firefox and Safari.So instead to setAttribute(), I changed to set the property directly by video.muted = true;.I tested on Chrome 59, Firefox 54, IE Edge, Safari (iPad and iMac) and it is working as expected.",C5,AF,L3,IAC,
googlearchive/vrview,207,"reorder render loop so focus is not called when loading new scene | When a scene is loaded that has hotspots, the focus_ method gets fired for each hotspot. This creates problems later on.When raycaster.intersectObjects (within the render loop) is called for the first time when new content is loaded it returns every new Object3D in the scene, and focus_ gets called for each hotspot.Moving the hotspotRenderer.update call below the effect render call stops this undesired behaviour. Fixes issue htt",C5,RA,L5,ICFM,Pipeline Misordering
googlearchive/vrview,208,reset pose and account for camera rotation when loading scene | atm the current camera rotation is not accounted for when setting up a new hotspot-started scene.  This can have the effect of images seeming to have the wrong orientation when loading after a hotspot is selected.  the display.theta_ is for desktops and the display.poseSensor_.resetPose() is for mobile devices. (including when touch panning is used and whether or not they have a working accelerometer)This fixes issue https://github.,C5,VF,L5,GCE,Incorrect Calculation
googlearchive/vrview,256,"Change order of rotation to yaw and then pitch | THREE is using local axis to rotate using Euler and the order is 'XYZ'by default. Before this change, it would rotate around X first for""pitch"" which would make local Y is than world Y, once it rotates aroundlocal ""Y"" for yaw the hotspot would end up being in the wrong place.This is not visible in the hotspots example as no pitch is set on any ofthe hotspots.",C5,SD,L4,GCE,Incorrect Calculation
googlearchive/webvr-ui,3,"Fix double enter vr event | When entering (native) vr, the fullscreen event also triggered, resulting in the state ending as 360 mode instead of vr mode. This checks if the manager is already in present mode before setting it to be in 360 mode. Also adding a check around the event.display in `vrdisplaypresentchange` event, since firefox doesnt send the display in the event",C5,VF,L5,ICFM,Scope Mismatch
googlevr/blocks,5,Fix tutorial | Add text mesh components back in and position correctly. Fix button actions,C5,SD,L3,IAC,
gtk2k/Unity-WebVR-Assets,15,"fix presentation in Chromium; show nice message over canvas when presenting (related to issue #4) | <img width=""1082"" alt=""screen shot 2016-05-10 at 9 25 43 pm"" src=""https://cloud.githubusercontent.com/assets/203725/15169939/c55e8044-16f5-11e6-9a6d-942604160316.png"">Tested in latest Chromium WebVR builds and Firefox Nightly. Presentation all good. And mirroring good on Firefox too. 😄 ",C4,AF,L5,ICFM,Pipeline Misordering
hackforla/VRMS,259,adds empty field check and disable btn styling | Fix for issue #219 : disabling button when the email text box is empty.I added in a test to make sure the email string isn't empty. I also added some :disabled styling in Checkin.scss. Note: the component structure of the checkin/login forms can use a refactor.![disabled_button_sm](https://user-images.githubusercontent.com/11682523/90478807-86fa4200-e0e2-11ea-9f8d-e4a73ca33923.gif),C5,IC,L3,ICFM,Scope Mismatch
hackforla/VRMS,363,Fix event listing page | Fixes the broken event list page on admin section of the application. This issue was brought up in the 10/26 VRMS meeting. The page is now seen working![image](https://user-images.githubusercontent.com/13891656/97288231-d192eb80-1802-11eb-9a68-75baa677eae2.png),C5,AF,L3,IIV,
hackforla/VRMS,480,Create A Radio Button As A New UI Element |  This fix the issue of #469 - [x] Added JSX for radio buttons- [x] Added styles for radio buttons (2 sizes)(sizes & colors have taken from `Figma UI Mockup`)- [x] **17px** by **17px** big radio button- [x] **13px** by **13px** small radio button- [x] **1px** border in radio buttons- [x] `#32373b` for border of the button- [x] `#C4C4C4` for selected option of the button,C5,AF,L3,UPF,
hackforla/VRMS,536,"Fix scrolling issue in the DEV UI KIT web page | Fixes #489 🌟️ **Reason**Our `app-main` class height is changing according to the different screens but `kit-container` class height is staying **628px** across all the screens. Scrolling is happening always for **628px** height, but `app-main` height is becoming less than **628px** for some screens and the scroll bar is going down more than **app-main** height so, the scroll bar is getting disappear and UI stuck at some point.So, adjusted **kit-co",C5,SD,L3,UPF,
hackforla/VRMS,537,fix (user): show user name in footer | This PR fixes one of the problems in #378 User data is passed down in the response for a request to /api/auth/me. This allows the user name to be accessed in the footer.Please note that logout functionality is not in this PR.![image](https://user-images.githubusercontent.com/25188961/116836772-4f4e0000-ab74-11eb-9096-cf4e057bc55a.png),C5,AF,L3,IIV,
hackforla/VRMS,598,"dev-ui-kit: Tweek 'input with icon' | ### OverviewThe input with icon component has two things that I noticed that we might want to change1. The placeholder text is cut off by the input. 2.  when you click on the icon, it does not focus on the input.<details>    <summary>screen shot</summary>![Screen Shot 2021-06-24 at 7 19 27 PM](https://user-images.githubusercontent.com/53061723/123373893-0fcfde80-d53b-11eb-9b3e-7f7614e0e57a.png)</details>### Action Items- [x] make it is its own component- [x]",C5,IC,L3,UPF,
hackforla/VRMS,615,"V0.3 - Magic Link login doesn't work on first try | ### OverviewI'm trying to log in to v0.3I enter my email address and receive the email with the magic linkI click the magic link and get the following error: <details><summary>Error Message</summary><img width=""674"" alt=""Screen Shot 2021-07-09 at 12 13 08 PM"" src=""https://user-images.githubusercontent.com/68244054/125127550-89c2a480-e0b1-11eb-8244-664eb91f88a0.png""></details>I reload the page and I'm logged in just fine.### Action Items- [ ] Fi",C5,IC,L3,IAC,
hackforla/VRMS,770,"fix bug to make the home page scrollable | Fixes a bug where the home page is not scrollable.Screen shots do not do anything because It is about scrolling..Try going to the [dev instance here](http://dev.vrms.io/) and shrink the height, and you can see",C5,SD,L3,UPF,
hackforla/VRMS,782,Fixed spacing between clickable or unclickable | closes #775 Used conditional rendering to render nav bar clickable or not on Navbar.jsAdded some css changes to Navbar.scss to fix the spacing issue. ,C5,SD,L3,ICFM,Scope Mismatch
hackforla/VRMS,1228,fix: Update active link CSS to be clearer | ![image](https://user-images.githubusercontent.com/5898009/196290327-a18a0ed5-e031-413d-a091-7c8bb6f54b2a.png),C5,AF,L3,UPF,
hackforla/VRMS,1229,"fix: Update events.js layout and CSS | I **believe** these changes don't break anything. I wans't able to test them on my local development server due to me not getting the login working locally.Rearranged link to be higher up the component tree in event.js so that clicking anywhere on the link goes to the event pageChanged CSS to add border, padding, highlight on hover",C5,AF,L3,UPF,
hackforla/VRMS,1339,"navbar changes v1 #1338 | Fixes #1338### What changes did you make and why did you make them ?  - Change the font size from 1rem to 20px.  - Changed the padding of the active underline by adding 10px like the Figma.       - See the comments for possible additional change.   - Updated the mt from 4 to 2 to match Figma margin.### Screenshots of Proposed Changes Of The Website  (if any, please do not screen shot code changes)<details><summary>Visuals before changes are applied</summary>![image](htt",C5,AF,L3,UPF,
hackforla/VRMS,1359,"fix projects sort bug | Fixes #1358### What changes did you make and why did you make them ?  - I added `?.` so that the cannot read undefined error doesn't break things### Screenshots of Proposed Changes Of The Website  (if any, please do not screen shot code changes)<!-- Note, if your images are too big, use the <img src="""" width="""" length="""" />  syntax instead of ![image](link) to format the images --><!-- If images are not loading properly, you might need to double check the syntax or add a ",C5,AF,L3,IIV,
hackforla/VRMS,1488,"fix: add back project fields hfla website url and  github identifier | Fixes an issue that bonnie had with fields missing..I just commented code back in<details><summary>Visuals before changes are applied</summary><img width=""554"" alt=""Screen Shot 2023-08-28 at 8 33 46 PM"" src=""https://github.com/hackforla/VRMS/assets/53061723/efb507c4-3e6f-41aa-afcc-dddefd09a546""></details><details><summary>Visuals after changes are applied</summary>  <img width=""640"" alt=""Screen Shot 2023-08-28 at 8 32 36 PM"" ",C5,AF,L3,IIV,
hackforla/VRMS,1492,"Normalize left side spacing on TextField MUI component | Fixes #1476### What changes did you make and why did you make them ?  - Added `paddingLeft: 0.5em` as a default for `MuiTextField`  - Addition made to make spacing on the left uniform### Screenshots of Proposed Changes Of The Website  (if any, please do not screen shot code changes)<!-- Note, if your images are too big, use the <img src="""" width="""" length="""" />  syntax instead of ![image](link) to format the images --><!-- If images are no",C5,AF,L3,UPF,
hackforla/VRMS,1516,"Ts.1477 | Fixes #1477### What changes did you make and why did you make them ?  - Create TitledBox component  - Refactor a few files to use new compon ent  - Resolves minor ui issue in `ProjectForm` heading being off kilter.### Screenshots of Proposed Changes Of The Website  (if any, please do not screen shot code changes)<!-- Note, if your images are too big, use the <img src="""" width="""" length="""" />  syntax instead of ![image](link) to format the images --><!-- If images are not loading proper",C5,AF,L3,RLM,Improper Initialization
hackforla/VRMS,1543,"UI rendering no meetings available issue 1515 | Fixes #1515### What changes did you make and why did you make them ?  -Added a `h4` heading indicating `No meetings available` , when no meetings are scheduled  -Changes are made to avoid confusion in meetings schedule### Screenshots of Proposed Changes Of The Website  (if any, please do not screen shot code changes)<!-- Note, if your images are too big, use the <img src="""" width="""" length="""" />  syntax instead of ![image](link) to format the image",C5,AF,L3,ICFM,Scope Mismatch
hackforla/VRMS,1552,"implement and style modal | Fixes #1391 ### What changes did you make and why did you make them ?  - Create ChangesModal Component  - trigger modal in New Project Form before discarding changes  - ensure functionality### Screenshots of Proposed Changes Of The Website  (if any, please do not screen shot code changes)<!-- Note, if your images are too big, use the <img src="""" width="""" length="""" />  syntax instead of ![image](link) to format the images --><!-- If images are not loading properly, you",C5,AF,L3,ICFM,Scope Mismatch
hackforla/VRMS,1554,"Update front page to MUI components 1547 | Fixes #1547 ### What changes did you make and why did you make them ?  - Replaced `<div>` with `<Box>`  - Created a theme and added styles  - Replaced `<h1>,<h2>,<h4>` with `Typography`### Screenshots of Proposed Changes Of The Website  (if any, please do not screen shot code changes)<!-- Note, if your images are too big, use the <img src="""" width="""" length="""" />  syntax instead of ![image](link) to format the images --><!-- If images are not loading pr",C5,AF,L3,UPF,
hackforla/VRMS,1563,Correcting the height of `UserManagment.js` to disable extra scrolling | Fixes #1561### What changes did you make and why did you make them ?  - removed the extra bottom margin from the component with id `container-usermanagement` to disable the extra scrolling functionality of the component  - This was done to make the UI in accordance to the design specified and correcting the height would result in enhancing the User experience as we have nothing below `Add new user` button### Screenshots of ,C5,AF,L3,UPF,
hackforla/VRMS,1567,"Feature-Fix: Removed project location from project management | …the  objectFixes #1565 ### What changes did you make and why did you make them ?  - Commented out the object rendering to the `Project Location` in `client/src/component/data.js` file  - This removed the instances of `Project Location` in the `Project Management` form  -  Changes are made as we didn't require the input field### Screenshots of Proposed Changes Of The Website  (if any, please do not screen shot code changes)<!-- Note",C5,AF,L3,RLM,Improper Operation
